{
  "instances": [],
  "instanceCommon": {
    "viewPath": "",
    "viewParams": {},
    "viewStyle": {
      "classes": ""
    }
  },
  "settings": {
    "direction": "row",
    "alignContent": "stretch",
    "alignItems": "stretch",
    "justify": "flex-start",
    "wrap": "nowrap"
  },
  "style": {
    "classes": ""
  }
}